{"job_id":"job_5gks1hqrrz4a8vkk0001","document_id":"doc_bgrreviewedsource0001","principal_id":"aaaaaaaaaaaaaaaaaaaaaaaaaaaaaaaaaaaaaaaaaaaaaaaaaaaaaaaaaaaaaaaa","collection":"nanolime","source_receipt_id":"sr_bgrreviewedsource0001","state":"SUCCEEDED","stage":"SUCCEEDED","fencing_token":1,"trace_id":"trace_bgr_contract_fixture"}
